{
  "commit": "e87bb897e15a6f2af402afb0f10b45eced9e1f9b",
  "component_type": "mcp_server",
  "description": "MCP server from microsoft/playwright-mcp. package_version is source metadata, not a verified npm artifact.",
  "id": "mcp.playwright-mcp",
  "license": "Apache-2.0",
  "name": "Playwright MCP",
  "publisher": "Microsoft",
  "source_repository": "https://github.com/microsoft/playwright-mcp",
  "status": "candidate",
  "version": "0.0.82"
}
